{
  "$schema": "https://json-schema.org/draft/2020-12/schema",
  "$id": "https://openknowledge.sh/schemas/cli/v1/job-run-plan.schema.json",
  "title": "Open Knowledge agent run plan v1",
  "type": "object",
  "required": [
    "schemaVersion", "run_id", "job_id", "job_file", "scheduled_at",
    "repo", "repo_root", "base", "base_sha", "branch", "worktree",
    "run_dir", "prompt", "verify_timeout", "sandbox", "output",
    "concurrency"
  ],
  "properties": {
    "schemaVersion": {"const": "1"},
    "run_id": {"type": "string", "pattern": "^[a-f0-9]{24}$"},
    "job_id": {"type": "string", "pattern": "^[A-Za-z0-9._-]+$"},
    "job_file": {"type": "string"},
    "scheduled_at": {"type": "string", "format": "date-time"},
    "repo": {"type": "string"},
    "repo_root": {"type": "string"},
    "base": {"type": "string"},
    "base_sha": {"type": "string", "pattern": "^[a-fA-F0-9]{40,64}$"},
    "branch": {"type": "string"},
    "worktree": {"type": "string"},
    "run_dir": {"type": "string"},
    "prompt": {"type": "string"},
    "agent": {"$ref": "#/$defs/agentCommand"},
    "preflight": {"type": "array", "items": {"$ref": "#/$defs/command"}},
    "preflight_timeout": {"type": "string", "minLength": 1},
    "verify": {"type": "array", "items": {"$ref": "#/$defs/command"}},
    "verify_timeout": {"type": "string", "minLength": 1},
    "eval": {"$ref": "#/$defs/eval"},
    "sandbox": {"$ref": "#/$defs/sandbox"},
    "output": {"$ref": "#/$defs/output"},
    "concurrency": {"$ref": "#/$defs/concurrency"}
  },
  "$defs": {
    "agentCommand": {
      "allOf": [
        {"$ref": "#/$defs/command"},
        {
          "type": "object",
          "required": ["runtime", "command", "prompt_mode"],
          "properties": {
            "runtime": {"enum": ["codex", "claude", "opencode"]},
            "command": {"type": "string"},
            "args": {"type": "array", "items": {"type": "string"}},
            "prompt_mode": {"enum": ["argument", "stdin"]},
            "env": {"type": "array", "items": {"type": "string", "pattern": "^[A-Za-z_][A-Za-z0-9_]*$"}},
            "shell": {"type": "boolean"}
          }
        }
      ]
    },
    "command": {
      "type": "object",
      "required": ["command"],
      "properties": {
        "runtime": {"enum": ["codex", "claude", "opencode"]},
        "command": {"type": "string"},
        "args": {"type": "array", "items": {"type": "string"}},
        "prompt_mode": {"enum": ["argument", "stdin"]},
        "env": {"type": "array", "uniqueItems": true, "items": {"type": "string", "pattern": "^[A-Za-z_][A-Za-z0-9_]*$"}},
        "shell": {"type": "boolean"}
      },
      "additionalProperties": false
    },
    "sandbox": {
      "type": "object",
      "required": ["type"],
      "properties": {
        "type": {"enum": ["host", "docker"]},
        "image": {"type": "string"},
        "network": {"enum": ["none", "bridge"]},
        "env": {"type": "array", "items": {"type": "string", "pattern": "^[A-Za-z_][A-Za-z0-9_]*$"}}
      },
      "additionalProperties": false
    },
    "output": {
      "type": "object",
      "properties": {
        "commit": {"type": "boolean"},
        "commit_message": {"type": "string"},
        "pr": {"type": "boolean"}
      },
      "additionalProperties": false
    },
    "concurrency": {
      "oneOf": [
        {"type": "object", "maxProperties": 0},
        {
          "type": "object",
          "required": ["key", "policy"],
          "properties": {
            "key": {"type": "string", "minLength": 1, "maxLength": 128, "pattern": "^[A-Za-z0-9._-]+$"},
            "policy": {"const": "skip"}
          },
          "additionalProperties": false
        }
      ]
    },
    "eval": {
      "type": "object",
      "required": ["dataset", "target", "spec", "gate", "base"],
      "properties": {
        "dataset": {"type": "string", "minLength": 1},
        "target": {"type": "string", "minLength": 1},
        "spec": {"type": "string", "minLength": 1},
        "gate": {"enum": ["all", "regressions"]},
        "base": {"type": "string", "pattern": "^[a-fA-F0-9]{40,64}$"},
        "answer_command": {"type": "string", "minLength": 1},
        "answer_args": {"type": "array", "items": {"type": "string"}},
        "answer_timeout": {"type": "string", "minLength": 1}
      },
      "additionalProperties": false
    }
  },
  "additionalProperties": false
}
