{
  "schemaVersion": "1",
  "run_id": "0123456789abcdef01234567",
  "job_id": "docs-audit",
  "job_file": "/work/project/.openknowledge/jobs/docs-audit.md",
  "scheduled_at": "2026-07-15T09:00:00Z",
  "repo": "/work/project",
  "repo_root": "/work/project",
  "base": "main",
  "base_sha": "0123456789abcdef0123456789abcdef01234567",
  "branch": "jobs/docs-audit/20260715-090000-0123456789abcdef01234567",
  "worktree": "/state/project/worktrees/0123456789abcdef01234567",
  "run_dir": "/state/project/runs/0123456789abcdef01234567",
  "prompt": "Open Knowledge agent contract (openknowledge-agent/v1)\n\nTask:\nAudit the documentation.\n",
  "agent": {
    "runtime": "codex",
    "command": "codex",
    "args": ["exec", "--sandbox", "workspace-write", "-"],
    "prompt_mode": "stdin"
  },
  "preflight_timeout": "15m",
  "verify": [
    {
      "command": "go test ./...",
      "shell": true
    }
  ],
  "verify_timeout": "15m",
  "sandbox": {
    "type": "docker",
    "image": "example.test/agent:latest",
    "network": "none",
    "env": ["PROJECT_READ_TOKEN"]
  },
  "output": {
    "commit": true,
    "commit_message": "docs: refresh knowledge"
  },
  "concurrency": {
    "key": "wiki-maintenance",
    "policy": "skip"
  }
}
